{
  "$schema": "../schemas/state-dimension.schema.json",
  "schemaVersion": "1.0",
  "key": "auth.dimension.entry-intent-status",
  "name": "Entry Intent Status",
  "summary": "Tracks the ephemeral application-entry intent independently from canonical identity state and client navigation.",
  "version": 1,
  "maturity": "proposed",
  "authority": "presentation-context",
  "valueType": "enumeration",
  "requiredForCanonicalSnapshot": false,
  "values": [
    { "key": "none", "name": "None", "summary": "No entry intent is attached to the current interaction." },
    { "key": "stashed", "name": "Stashed", "summary": "A validated entry intent is retained for later routing." },
    { "key": "consumed", "name": "Consumed", "summary": "The entry intent was explicitly consumed once by a dedicated action.", "terminal": true },
    { "key": "expired", "name": "Expired", "summary": "The entry intent expired before use.", "terminal": true },
    { "key": "invalid", "name": "Invalid", "summary": "The entry intent failed validation and cannot influence routing.", "terminal": true }
  ],
  "sourceReferences": [
    { "sourceType": "code", "reference": "src/LagoVista.UserAdmin/Interfaces/IEntryIntentService.cs", "note": "Entry intent stash, TTL, and destructive ConsumeAsync contract." },
    { "sourceType": "discussion", "reference": "AUTH-MODEL-GUIDE.md", "section": "4.13" }
  ]
}