{
  "$schema": "../schemas/state-dimension.schema.json",
  "schemaVersion": "1.0",
  "key": "auth.dimension.presentation-context",
  "name": "Presentation Context",
  "summary": "Identifies the interaction channel presenting the same logical actions without changing behavioral truth.",
  "version": 1,
  "maturity": "proposed",
  "authority": "presentation-context",
  "valueType": "enumeration",
  "requiredForCanonicalSnapshot": false,
  "values": [
    { "key": "none", "name": "None", "summary": "No presentation channel is currently attached." },
    { "key": "web-form", "name": "Web Form", "summary": "Traditional web form presentation." },
    { "key": "mobile-form", "name": "Mobile Form", "summary": "Traditional mobile form presentation." },
    { "key": "guided-vtm", "name": "Guided VTM", "summary": "Conversational onboarding or invite resolution through a VTM or Concierge." },
    { "key": "server", "name": "Server", "summary": "Server-only execution or invariant evaluation with no UI presentation." },
    { "key": "automation", "name": "Automation", "summary": "A platform runner is executing a presentation binding." }
  ],
  "sourceReferences": [
    { "sourceType": "discussion", "reference": "AUTH-MODEL-GUIDE.md", "section": "2.4" }
  ]
}